{
  "$schema": "../schema/real_reviewable_finding.schema.json",
  "contract": "real-reviewable-finding-v1",
  "id": "public-procurement-conflict-interest-plx33",
  "domain": "bounded public procurement",
  "issue_type": "lacuna",
  "title": "Clarificare necesară între interdicția cumulului și regimul conflictului de interese din achiziții publice",
  "status": "reviewed",
  "reviewer": {
    "name": "pilot-reviewer-declared",
    "reviewed_at": "2026-09-14T00:00:00+03:00",
    "note": "Constatare pilot pentru fluxul real-data; nu este verdict juridic."
  },
  "finding": {
    "act_id": "lege-98-2016",
    "locator": "art. 58",
    "quote": "autoritatea contractantă are obligația de a lua toate măsurile necesare pentru a preveni, identifica și remedia situațiile de conflict de interese",
    "source_url": "https://legislatie.just.ro/Public/DetaliiDocument/178667",
    "source_path": "sources/lege-98-2016.html.gz",
    "source_sha256": "9e96ff1c5b0d427376e352d5149174b6e7b51072edc4708343d6fc5713703762",
    "reasoning": "Proiectul-pilot privind cumulul funcțiilor finanțate din bugetul de stat declară ca scop evitarea conflictului de interese. Pentru domeniul achizițiilor publice, formularea trebuie păstrată coordonată cu obligația expresă din art. 58 din Legea nr. 98/2016, fără a crea o derogare implicită sau o suprapunere neclară."
  },
  "related_sources": [
    {
      "kind": "cdep_fisa_snapshot",
      "id": "plx-33-2025",
      "act_id": "plx-33-2025",
      "locator": "obiect de reglementare",
      "quote": "Propunerea legislativă are ca obiect de reglementare interzicerea cumulului de funcţii finanţate din bugetul de stat.",
      "source_url": "https://www.cdep.ro/ords/pls/proiecte/upl_pck2015.proiect?cam=2&idp=21949",
      "source_path": "tests/fixtures/cdep_fisa.html.gz",
      "source_sha256": "087a34f5e768cda95cf5b8c58c0b4509291c72f7c6c6b99055edd5f12b621cfb"
    }
  ],
  "proposal": {
    "title": "Clauză de corelare pentru procedurile de achiziții publice",
    "wording": "În aplicarea prezentei legi, măsurile privind interzicerea cumulului funcțiilor finanțate din bugetul de stat nu aduc atingere obligațiilor autorităților contractante prevăzute la art. 58 din Legea nr. 98/2016 privind achizițiile publice, referitoare la prevenirea, identificarea și remedierea situațiilor de conflict de interese.",
    "rationale": "Menține obiectivul proiectului-pilot și declară expres că regimul special al conflictului de interese din achiziții publice rămâne aplicabil."
  },
  "limitations": [
    "Constatare pilot, verificabilă prin sursele indicate, nu concluzie juridică oficială.",
    "Nu confirmă compatibilitatea proiectului cu întregul drept intern sau UE.",
    "Nu folosește AI și nu substituie revizia unui jurist."
  ]
}
